{
  "$schema": "http://json-schema.org/draft-07/schema#",
  "$id": "casey/expected-frozen.json",
  "title": "Casey 冻结断言契约旁车 expected.frozen.json",
  "description": "护栏 #5 物理隔离：人签后的逐 intent typed expected[] + 期望多态裁定，独立于 gate 写的 passes，进 testChecksums（改断言触棘轮、自愈改 locator 不触）。prd-<caseId>.json(schemaVersion 2) 经 expectedFrozenPath 引用本文件。runtime 的 actual/ok/观测裁定永远只进 StepAxes/verdict.json，绝不回写本契约（fail-safe 分进程，护栏 #15）。",
  "type": "object",
  "additionalProperties": false,
  "required": ["caseId", "intents"],
  "properties": {
    "caseId": { "type": "string", "description": "TestCase 聚合根 id，与 prd/verdict.json/StepAxes 同一标识" },
    "channel": { "enum": ["web", "cef", "arbitrary"], "description": "回放通道；仅影响断言成功字段参数化（错误信封），裁定/报告 channel 无关" },
    "intents": {
      "type": "array",
      "minItems": 1,
      "description": "逐 intent 的冻结断言契约（人签后写入）。一条 intentId 对应 N 个回放 stepId，由 verdict.json 卷回",
      "items": { "$ref": "#/definitions/intentContract" }
    },
    "globalAssertions": {
      "type": "array",
      "description": "全局冻结断言（noPageError/noErrorEnvelope/noErrorToast 等取证类，跨 intent 生效，设计 §2）",
      "items": { "$ref": "#/definitions/frozenAssertion" }
    }
  },
  "definitions": {
    "intentContract": {
      "type": "object",
      "additionalProperties": false,
      "required": ["intentId", "expected"],
      "properties": {
        "intentId": { "type": "string", "description": "意图步标识（用例语义步 id，authoring 时写）；区别于回放事件位置式 stepId" },
        "intent": { "type": "string", "description": "意图自然语言描述（人/LLM authoring）" },
        "expected": {
          "type": "array",
          "minItems": 1,
          "description": "本 intent 的冻结 typed 断言集（断言续跑、逐条出结果、不首错即停）",
          "items": { "$ref": "#/definitions/frozenAssertion" }
        },
        "expectedVerdict": {
          "$ref": "#/definitions/verdictAdjudication",
          "description": "人签时记录的期望多态裁定基线（report 用它对比 runtime verdict.json；tier-1 合成 golden 直接以它为期望）。runtime 观测裁定绝不回写本契约"
        }
      }
    },
    "frozenAssertion": {
      "type": "object",
      "additionalProperties": false,
      "description": "一条冻结的带类型断言 + 人签元数据。runtime 的 actual/ok 不进冻结契约（属 StepAxes/verdict.json 运行态）",
      "required": ["kind", "signedAt", "signedAgainstBuild", "signerId"],
      "properties": {
        "kind": { "$ref": "#/definitions/assertionKind" },
        "op": { "$ref": "#/definitions/assertionOp" },
        "value": {
          "type": ["string", "number", "boolean"],
          "description": "断言比较值；含 uniqueName/ts 的易变值必模板化（{{uniqueName}}/{{ts}}），绝不冻字面量（设计 §2.1 determinism 铁律）"
        },
        "soft": {
          "type": "boolean",
          "default": false,
          "description": "true=软断言，只进报告不进裁定树（verdict.mjs 仅 soft===true 才排除）；缺省/false=硬断言"
        },
        "signedAt": { "type": "string", "format": "date-time", "description": "人签时刻（ISO 8601）。期望版本化锚点之一" },
        "signedAgainstBuild": { "type": "string", "description": "本期望所针对的 SUT 构建标识；有意改版后走重签，不自动记缺陷（设计 §4.3）" },
        "signerId": { "type": "string", "description": "签署人标识（人签门责任落点）" }
      }
    },
    "assertionKind": {
      "description": "断言词汇表（设计 §2.1）；LLM 不准发明自由断言。kind 枚举权威活在 bin/check.mjs，本表与之对齐",
      "enum": ["urlPathname", "textVisible", "countChange", "inputReadback", "dropdownReadback", "requiredFilled", "streamReplyReceived", "replyContains", "replyMatches", "noPageError", "noErrorEnvelope", "noErrorToast"]
    },
    "assertionOp": {
      "description": "每种 kind 允许的 op（设计 §2.1 收紧 + 取证类 envelopeOk/absent）；per-kind op 约束留 P4 加固；equals 含 ID/atl_ 字面量冻结期 lint 报红",
      "enum": ["startsWith", "matches", "equals", "appears", "up", "down", "envelopeOk", "absent"]
    },
    "verdictState": {
      "description": "多态裁定四态（与 verdict.json/CONTEXT.md 同一 Published Language）。PASS/SUT_DEFECT/HARNESS_ERROR 为终判（reason=null）；NEEDS_HUMAN 必带 reason 子类",
      "enum": ["PASS", "SUT_DEFECT", "HARNESS_ERROR", "NEEDS_HUMAN"]
    },
    "verdictReason": {
      "description": "NEEDS_HUMAN 的 reason 子类（设计 §4.3）",
      "enum": ["SUT_DEFECT_OR_STALE", "CASE_DEFECT", "AMBIGUOUS_ACTION", "AFFORDANCE_ABSENT", "INDETERMINATE"]
    },
    "verdictAdjudication": {
      "type": "object",
      "additionalProperties": false,
      "description": "一个多态裁定记录，字段名与 verdict.json 逐步项 {verdict, reason} 一致。终判 reason 必 null；NEEDS_HUMAN reason 必为子类（fail-safe 不变量，镜像 bin/verdict.mjs §4.2）",
      "required": ["verdict"],
      "properties": {
        "verdict": { "$ref": "#/definitions/verdictState" },
        "reason": { "oneOf": [{ "$ref": "#/definitions/verdictReason" }, { "type": "null" }] }
      },
      "allOf": [
        {
          "if": { "properties": { "verdict": { "const": "NEEDS_HUMAN" } }, "required": ["verdict"] },
          "then": { "properties": { "reason": { "$ref": "#/definitions/verdictReason" } }, "required": ["reason"] },
          "else": { "properties": { "reason": { "type": "null" } } }
        }
      ]
    }
  }
}
